{
  "schema_version": 1,
  "generated_at": "2026-08-01T16:06:42.355902+00:00",
  "summary": {
    "total": 48,
    "passed": 47,
    "failed": 1,
    "not_run": 0
  },
  "results": [
    {
      "host": "claude-code",
      "environment": "isolated",
      "skill": "technical-research",
      "type": "positive",
      "case_id": 1,
      "status": "passed",
      "actual": "technical-research",
      "error": null
    },
    {
      "host": "claude-code",
      "environment": "isolated",
      "skill": "behavioral-testing",
      "type": "positive",
      "case_id": 1,
      "status": "passed",
      "actual": "behavioral-testing",
      "error": null
    },
    {
      "host": "claude-code",
      "environment": "isolated",
      "skill": "codex-review",
      "type": "positive",
      "case_id": 1,
      "status": "passed",
      "actual": "codex-review",
      "error": null
    },
    {
      "host": "claude-code",
      "environment": "isolated",
      "skill": "ascii-diagram",
      "type": "positive",
      "case_id": 1,
      "status": "passed",
      "actual": "ascii-diagram",
      "error": null
    },
    {
      "host": "claude-code",
      "environment": "isolated",
      "skill": "browser-operations",
      "type": "positive",
      "case_id": 1,
      "status": "passed",
      "actual": "browser-operations",
      "error": null
    },
    {
      "host": "claude-code",
      "environment": "isolated",
      "skill": "cloudflare-worker-cd",
      "type": "positive",
      "case_id": 1,
      "status": "passed",
      "actual": "cloudflare-worker-cd",
      "error": null
    },
    {
      "host": "claude-code",
      "environment": "isolated",
      "skill": "context-handoff",
      "type": "positive",
      "case_id": 1,
      "status": "passed",
      "actual": "context-handoff",
      "error": null
    },
    {
      "host": "claude-code",
      "environment": "isolated",
      "skill": "html-artifact",
      "type": "positive",
      "case_id": 1,
      "status": "passed",
      "actual": "html-artifact",
      "error": null
    },
    {
      "host": "claude-code",
      "environment": "isolated",
      "skill": "ai-native-engineering",
      "type": "positive",
      "case_id": 1,
      "status": "passed",
      "actual": "ai-native-engineering",
      "error": null
    },
    {
      "host": "claude-code",
      "environment": "isolated",
      "skill": "typescript-project-foundation",
      "type": "positive",
      "case_id": 1,
      "status": "passed",
      "actual": "typescript-project-foundation",
      "error": null
    },
    {
      "host": "claude-code",
      "environment": "isolated",
      "skill": "gog-calendar",
      "type": "positive",
      "case_id": 1,
      "status": "passed",
      "actual": "gog-calendar",
      "error": null
    },
    {
      "host": "claude-code",
      "environment": "isolated",
      "skill": "github-project-provisioning",
      "type": "positive",
      "case_id": 1,
      "status": "passed",
      "actual": "github-project-provisioning",
      "error": null
    },
    {
      "host": "claude-code",
      "environment": "superset",
      "skill": "technical-research",
      "type": "positive",
      "case_id": 1,
      "status": "passed",
      "actual": "technical-research",
      "error": null
    },
    {
      "host": "claude-code",
      "environment": "superset",
      "skill": "behavioral-testing",
      "type": "positive",
      "case_id": 1,
      "status": "passed",
      "actual": "behavioral-testing",
      "error": null
    },
    {
      "host": "claude-code",
      "environment": "superset",
      "skill": "codex-review",
      "type": "positive",
      "case_id": 1,
      "status": "passed",
      "actual": "codex-review",
      "error": null
    },
    {
      "host": "claude-code",
      "environment": "superset",
      "skill": "ascii-diagram",
      "type": "positive",
      "case_id": 1,
      "status": "passed",
      "actual": "ascii-diagram",
      "error": null
    },
    {
      "host": "claude-code",
      "environment": "superset",
      "skill": "browser-operations",
      "type": "positive",
      "case_id": 1,
      "status": "passed",
      "actual": "browser-operations",
      "error": null
    },
    {
      "host": "claude-code",
      "environment": "superset",
      "skill": "cloudflare-worker-cd",
      "type": "positive",
      "case_id": 1,
      "status": "passed",
      "actual": "cloudflare-worker-cd",
      "error": null
    },
    {
      "host": "claude-code",
      "environment": "superset",
      "skill": "context-handoff",
      "type": "positive",
      "case_id": 1,
      "status": "passed",
      "actual": "context-handoff",
      "error": null
    },
    {
      "host": "claude-code",
      "environment": "superset",
      "skill": "html-artifact",
      "type": "positive",
      "case_id": 1,
      "status": "passed",
      "actual": "html-artifact",
      "error": null
    },
    {
      "host": "claude-code",
      "environment": "superset",
      "skill": "ai-native-engineering",
      "type": "positive",
      "case_id": 1,
      "status": "failed",
      "actual": "disambiguate",
      "error": null
    },
    {
      "host": "claude-code",
      "environment": "superset",
      "skill": "typescript-project-foundation",
      "type": "positive",
      "case_id": 1,
      "status": "passed",
      "actual": "typescript-project-foundation",
      "error": null
    },
    {
      "host": "claude-code",
      "environment": "superset",
      "skill": "gog-calendar",
      "type": "positive",
      "case_id": 1,
      "status": "passed",
      "actual": "gog-calendar",
      "error": null
    },
    {
      "host": "claude-code",
      "environment": "superset",
      "skill": "github-project-provisioning",
      "type": "positive",
      "case_id": 1,
      "status": "passed",
      "actual": "github-project-provisioning",
      "error": null
    },
    {
      "host": "codex",
      "environment": "isolated",
      "skill": "technical-research",
      "type": "positive",
      "case_id": 1,
      "status": "passed",
      "actual": "technical-research",
      "error": null
    },
    {
      "host": "codex",
      "environment": "isolated",
      "skill": "behavioral-testing",
      "type": "positive",
      "case_id": 1,
      "status": "passed",
      "actual": "behavioral-testing",
      "error": null
    },
    {
      "host": "codex",
      "environment": "isolated",
      "skill": "codex-review",
      "type": "positive",
      "case_id": 1,
      "status": "passed",
      "actual": "codex-review",
      "error": null
    },
    {
      "host": "codex",
      "environment": "isolated",
      "skill": "ascii-diagram",
      "type": "positive",
      "case_id": 1,
      "status": "passed",
      "actual": "ascii-diagram",
      "error": null
    },
    {
      "host": "codex",
      "environment": "isolated",
      "skill": "browser-operations",
      "type": "positive",
      "case_id": 1,
      "status": "passed",
      "actual": "browser-operations",
      "error": null
    },
    {
      "host": "codex",
      "environment": "isolated",
      "skill": "cloudflare-worker-cd",
      "type": "positive",
      "case_id": 1,
      "status": "passed",
      "actual": "cloudflare-worker-cd",
      "error": null
    },
    {
      "host": "codex",
      "environment": "isolated",
      "skill": "context-handoff",
      "type": "positive",
      "case_id": 1,
      "status": "passed",
      "actual": "context-handoff",
      "error": null
    },
    {
      "host": "codex",
      "environment": "isolated",
      "skill": "html-artifact",
      "type": "positive",
      "case_id": 1,
      "status": "passed",
      "actual": "html-artifact",
      "error": null
    },
    {
      "host": "codex",
      "environment": "isolated",
      "skill": "ai-native-engineering",
      "type": "positive",
      "case_id": 1,
      "status": "passed",
      "actual": "ai-native-engineering",
      "error": null
    },
    {
      "host": "codex",
      "environment": "isolated",
      "skill": "typescript-project-foundation",
      "type": "positive",
      "case_id": 1,
      "status": "passed",
      "actual": "typescript-project-foundation",
      "error": null
    },
    {
      "host": "codex",
      "environment": "isolated",
      "skill": "gog-calendar",
      "type": "positive",
      "case_id": 1,
      "status": "passed",
      "actual": "gog-calendar",
      "error": null
    },
    {
      "host": "codex",
      "environment": "isolated",
      "skill": "github-project-provisioning",
      "type": "positive",
      "case_id": 1,
      "status": "passed",
      "actual": "github-project-provisioning",
      "error": null
    },
    {
      "host": "codex",
      "environment": "superset",
      "skill": "technical-research",
      "type": "positive",
      "case_id": 1,
      "status": "passed",
      "actual": "technical-research",
      "error": null
    },
    {
      "host": "codex",
      "environment": "superset",
      "skill": "behavioral-testing",
      "type": "positive",
      "case_id": 1,
      "status": "passed",
      "actual": "behavioral-testing",
      "error": null
    },
    {
      "host": "codex",
      "environment": "superset",
      "skill": "codex-review",
      "type": "positive",
      "case_id": 1,
      "status": "passed",
      "actual": "codex-review",
      "error": null
    },
    {
      "host": "codex",
      "environment": "superset",
      "skill": "ascii-diagram",
      "type": "positive",
      "case_id": 1,
      "status": "passed",
      "actual": "ascii-diagram",
      "error": null
    },
    {
      "host": "codex",
      "environment": "superset",
      "skill": "browser-operations",
      "type": "positive",
      "case_id": 1,
      "status": "passed",
      "actual": "browser-operations",
      "error": null
    },
    {